5132710d-8056-4e9d-94f5-e33125701b39,2020. 03. 20. 0:22:07,26,0,"Joker szarás?","Mi az a Joker szarás?",
54abcffc-780e-4ec1-aefa-c0901d484705,2020. 03. 20. 8:49:02,0,0,"Alma szedés","faszaaa",
dd107b5a-6eb2-4976-b629-bf3397b3ebc4,2020. 03. 20. 9:01:06,5,0,"ASP.NET használat","Hogy kell elindulni benne?",
1d5e1c41-61f1-445d-ade1-a2c8137e2c51,2020. 03. 20. 9:09:57,2,0,"Belém tört a kolbász, mit csináljak?","Nagyon meg vagyok ijedve, mert tegnap este önkielégítés közben belém tört egy lecsókolbász. Nem nagydarab kb. 5-6 centi, de sehogy nem tudom kiszedni. Segítsetek, hogy szedhetném ki?",
7ca5ce4b-6229-4c4e-aceb-8413f2ce65a3,2020. 03. 20. 9:11:00,2,0,"Ez hogyan lehetséges? Nem értem! Bővebben lent!","Kb. 3 hete a egyetemre levizeltem a falat és másnap mikor mentem egyetemre ott mentem el mellette, és láttam hogy valamiféle írás rajzolodott ki belôle nem latin betükkel. Ma mikor felkeltem ugyanez az irás látszódott a szobám falán, megszagoltam és vizelet szaga volt. Egyedül lakom, és nincs háziállatom. Mi lehet ez????!!!! Többször is vizeltem le falat de ez felháborító!!! Nem álltam sem alkohol sem kábítószer hatása alatt egyik esetnél sem. Barátnôm szerint csak nagyon kimerültem. De ezt még mindig nemtudom felfogni! 23/F",
529ec41e-7fe4-42e7-be13-c3d485d28b46,2020. 03. 20. 9:12:10,0,0,"A 3-4 napig a mélyhűtőben tartott tojás kikell-e ha felmelegítem és több napig ezt csinálom vele?","Kiss koromba mindig szeretem volna egy csibét ezért kérdezem.",
cd5fa6af-b33c-4794-b702-2614a560c6a7,2020. 03. 20. 9:13:03,4,0,"Milyen szaguk van az ufo-knak?","Milyen szaguk van az ufo-knak?",
65e1d050-145c-4b20-954f-a35e21cb7dd5,2020. 03. 20. 9:15:04,2,0,"Menzesz alatt vettem melltartót. Befolyásolja ez a méretet?","-",
e7eaebe3-a585-42f9-b02a-f5f81068faa0,2020. 03. 20. 9:17:00,1,0,"Mit játszhatok a hörimmel?","-",
